이름,AI활용정도,가장편했던툴,강점,기여가능한경험,기존키오스크개선점,별로였던키오스크,사용AICLI코딩툴,사용AI웹서비스,새로배우고싶은기술,선호IDE,선호역할,일정충돌예정,자신없는부분,좋았던키오스크,주당투입가능시간,프로젝트기대하는것,피드백선호,학습_보완하고싶은영역,학습_어려웠던부분,학습_자신있는영역,학습_잘맞았던부분,협업스타일,흥미느낀쪽
,,,,,,,,,,,,,,,,,,,,,,,
,코드 일부 생성,"스프링툴, VS Code",눈치를 잘 살펴서 팀 분위기를 빨리 읽을 수 있음,경험은 없지만 열심히 해보려 노력하겠음,시각장애인이나 고령층을 위한 음성인식 기능,"메가커피 - 화면이 작아 터치 불편, 결제까지 터치가 많아 오래걸림",코파일럿,제미나이,AI 활용하는 법을 더 배워보고 싶음,"스프링툴, VS Code",상관없음,,팀플 경험 없어 어리바리 할 수 있음,버거킹 - 쿠폰 사용과 결제가 빨리 이루어져서 편리했음,5-10시간,팀끼리 조화가 잘 어울려져서 만족할 수 있는 결과 도출,부드럽게 전달 선호,코드에 대해 더 이해하고 리액트/자바 더 공부 필요,코드 자체를 처음 접해봐 코드 짜는 부분을 이해하기 어려웠음,"피그마(전 강사님께 수업), 자바/리액트는 AI 도움 많이 받음",리액트 할 때 흥미가 많이 생김,혼자 좀 해결해보다가 더이상 안될 것 같으면 물어보는 편,둘 다 비슷
김나연,자동완성 정도,"Antigravity, IntelliJ, Eclipse, VS Code","상황판단이 좋고 책임감이 강함, 전직장 팀프로젝트 경험(팀원 조율/문제해결)","퍼블리셔로 1년간 근무, 프로젝트 3개 진행 경험, 팀원간 소통/조율 능력",분할결제가 기본 제공되지 않는 경우가 있어 개선 필요,"메가커피 - 메뉴 광범위하고 정보 많아 고르기 불편, 결제UI도 옵션 많아 번잡함",Copilot,제미나이,AI 프롬프트 활용,"Antigravity, IntelliJ, Eclipse, VS Code",상관없음,딱히 없음,하려 하지 않는 사람에게는 베푸는 성격이 아니라고 스스로 판단,"버거킹 - 심플하고 깔끔한 UI, 쿠폰 바코드 스캔시 할인상품 바로 결제연결",15시간 이상,AI를 활용해서 어디까지 가능할지 기대,직설적 피드백 OK,"리액트, 파이썬 더 보완, JPA/MyBatis DB연동 연습 더","리액트로 컴포넌트 만들어 화면 구성하는 부분이 낯설고 어려움, 프론트/백엔드 선생님 스타일 차이로 혼란",자바로 데이터 전달하는 작업,자바 MVC 프로젝트와 Spring Boot 수업(URL mapping 등),혼자 먼저 해보고 오래걸릴 것 같으면 바로 질문,둘 다 비슷
,전체 로직까지 생성,"VS Code, IntelliJ","현시점 판단 어려움, 열심히 따라가겠음","팀플 경험 많아 방해되지 않을 자신, 다만 웹 부분은 처음",포인트적립/혜택 여부를 결제 전에 미리 결정하게 해서 결제 도중 끊기지 않게 (REQ-009와 일치),UI 인식이 별로였던 키오스크(결제버튼 위치 이상하거나 복잡한 경우),"Cursor, Copilot",ChatGPT,어느 한쪽이라도 중급 정도 숙지,"VS Code, IntelliJ",상관없음,남은 일정간 무리없음,0에서 1을 처음 만들 때,"이용자 편의를 먼저 고려한 단순한 UI, 결제 안될 시 데스크에서 결제 가능한 곳",5-10시간,맡은 파트 및 작업 부분을 제대로 숙지하는 것,직설적 피드백 OK,전체적으로 전 파트,"새로운 메소드, 구문 암기 등 새 파트 나갈 때마다",,배운 후 단기간 내 복습/실습하면 비교적 수월했음,혼자하다가 정 안되면 질문,둘 다 비슷
이하진,전체 로직까지 생성,"VS Code, Cursor, Eclipse, DBeaver","메타인지가 좋음, 찾아서 하는 거 좋아함, 끈기있음, 꼼꼼함(나름)",요식업에 오래 일한 만큼 사용자/관리자 측면에서 실효성을 고려해볼 수 있을 듯함,"단조롭기보다 심플하고 눈에 들어왔으면 좋겠고, 사용자 입장에서 단계가 진행되었으면 함",맘스터치 - 골라야하는 단계가 편리하지 않았음,"클로드, 커서, 코덱스","지피티, 클로드, 커서",실무에 실제 쓰이는 기능이나 구조,"VS Code, Cursor, Eclipse, DBeaver",상관없음,특별히 없지만 최근 출결 관리에 주의가 필요하다고 스스로 언급,"다정함과 공감, 자꾸 혼자 하려는 경향, 팀플 경험 없음","공차, 버거킹, SPC 계열 - 구성이 좋고 UI가 단조롭지 않았음",15시간 이상,간단한 조각들만 만들어봤는데 다같이 실사용 가능한 완전체를 만들어보는 것,직설적 피드백 OK,"CSS는 거의 까먹음, 프론트는 AI 없이 거의 못 짬",이전 진도를 자꾸 까먹어서 기본기를 잊음,객관적인 시선,데이터 관리,"바로 묻기보다 혼자 파기-AI채찍질하기-논의하는 편, 안되면 꽤 오래 붙잡고 있는 편, 사소한 거에 집착함",백엔드
